tcpdump -i any -c 10


tcpdump: data link type LINUX_SLL2
tcpdump: verbose output suppressed, use -v[v]... for full protocol decode
listening on any, link-type LINUX_SLL2 (Linux cooked v2), snapshot length 262144 bytes
22:23:49.815803 eth0  Out IP comp3134-Winter2026.ssh > 162.243.188.66.47888: Flags [P.], seq 358684921:358685017, ack 3466501647, win 502, options [nop,nop,TS val 1079932716 ecr 2355046741], length 96
22:23:49.815869 eth0  Out IP comp3134-Winter2026.ssh > 162.243.188.66.47888: Flags [P.], seq 96:160, ack 1, win 502, options [nop,nop,TS val 1079932716 ecr 2355046741], length 64
22:23:49.818173 eth0  Out IP comp3134-Winter2026.ssh > 162.243.188.66.47888: Flags [P.], seq 160:288, ack 1, win 502, options [nop,nop,TS val 1079932718 ecr 2355046741], length 128
22:23:49.818243 eth0  Out IP comp3134-Winter2026.ssh > 162.243.188.66.47888: Flags [P.], seq 288:352, ack 1, win 502, options [nop,nop,TS val 1079932718 ecr 2355046741], length 64
22:23:49.818282 eth0  Out IP comp3134-Winter2026.ssh > 162.243.188.66.47888: Flags [P.], seq 352:432, ack 1, win 502, options [nop,nop,TS val 1079932718 ecr 2355046741], length 80
22:23:49.818325 eth0  Out IP comp3134-Winter2026.ssh > 162.243.188.66.47888: Flags [P.], seq 432:528, ack 1, win 502, options [nop,nop,TS val 1079932718 ecr 2355046741], length 96
22:23:49.818371 eth0  Out IP comp3134-Winter2026.ssh > 162.243.188.66.47888: Flags [P.], seq 528:608, ack 1, win 502, options [nop,nop,TS val 1079932718 ecr 2355046741], length 80
22:23:49.818400 eth0  Out IP comp3134-Winter2026.ssh > 162.243.188.66.47888: Flags [P.], seq 608:672, ack 1, win 502, options [nop,nop,TS val 1079932718 ecr 2355046741], length 64
22:23:49.822918 eth0  In  IP 162.243.188.66.47888 > comp3134-Winter2026.ssh: Flags [.], ack 0, win 501, options [nop,nop,TS val 2355046764 ecr 1079932710], length 0
22:23:49.829148 eth0  In  IP 162.243.188.66.47888 > comp3134-Winter2026.ssh: Flags [.], ack 96, win 501, options [nop,nop,TS val 2355046770 ecr 1079932716], length 0
10 packets captured
53 packets received by filter
0 packets dropped by kernel