tcpdump -i any -c 10


tcpdump: data link type LINUX_SLL2
tcpdump: verbose output suppressed, use -v[v]... for full protocol decode
listening on any, link-type LINUX_SLL2 (Linux cooked v2), snapshot length 262144 bytes
22:31:23.292840 eth0  Out IP comp3134-Winter2026.ssh > 162.243.188.66.47888: Flags [P.], seq 358690569:358690665, ack 3466502111, win 502, options [nop,nop,TS val 1080386193 ecr 2355500235], length 96
22:31:23.293591 eth0  Out IP comp3134-Winter2026.ssh > 162.243.188.66.47888: Flags [P.], seq 96:160, ack 1, win 502, options [nop,nop,TS val 1080386194 ecr 2355500235], length 64
22:31:23.295481 eth0  Out IP comp3134-Winter2026.ssh > 162.243.188.66.47888: Flags [P.], seq 160:288, ack 1, win 502, options [nop,nop,TS val 1080386195 ecr 2355500235], length 128
22:31:23.295570 eth0  Out IP comp3134-Winter2026.ssh > 162.243.188.66.47888: Flags [P.], seq 288:352, ack 1, win 502, options [nop,nop,TS val 1080386196 ecr 2355500235], length 64
22:31:23.295610 eth0  Out IP comp3134-Winter2026.ssh > 162.243.188.66.47888: Flags [P.], seq 352:432, ack 1, win 502, options [nop,nop,TS val 1080386196 ecr 2355500235], length 80
22:31:23.295653 eth0  Out IP comp3134-Winter2026.ssh > 162.243.188.66.47888: Flags [P.], seq 432:528, ack 1, win 502, options [nop,nop,TS val 1080386196 ecr 2355500235], length 96
22:31:23.295691 eth0  Out IP comp3134-Winter2026.ssh > 162.243.188.66.47888: Flags [P.], seq 528:608, ack 1, win 502, options [nop,nop,TS val 1080386196 ecr 2355500235], length 80
22:31:23.295720 eth0  Out IP comp3134-Winter2026.ssh > 162.243.188.66.47888: Flags [P.], seq 608:672, ack 1, win 502, options [nop,nop,TS val 1080386196 ecr 2355500235], length 64
22:31:23.298229 eth0  In  IP 162.243.188.66.47888 > comp3134-Winter2026.ssh: Flags [.], ack 4294967232, win 501, options [nop,nop,TS val 2355500248 ecr 1080386185], length 0
22:31:23.298694 eth0  In  IP 162.243.188.66.47888 > comp3134-Winter2026.ssh: Flags [.], ack 0, win 501, options [nop,nop,TS val 2355500249 ecr 1080386185], length 0
10 packets captured
39 packets received by filter
0 packets dropped by kernel